{
  "$schema": "https://json-schema.org/draft/2020-12/schema",
  "$id": "https://raw.githubusercontent.com/detain/phlix-plugins/HEAD/plugins.schema.json",
  "title": "Phlix plugin catalog",
  "description": "Schema for a Phlix plugin catalog document (plugins.json). The catalog is the trust root the Phlix server reads to drive admin plugin installs; each entry pins an exact commit (ref) and the sha256 of the codeload tarball for that commit (artifactSha256) so the server can verify the bytes it downloads before installing.",
  "type": "object",
  "required": ["schemaVersion", "name", "plugins"],
  "additionalProperties": false,
  "properties": {
    "schemaVersion": {
      "description": "Catalog format version. Version 2 introduces the per-entry pin (ref + artifactSha256 + version).",
      "const": 2
    },
    "name": {
      "description": "Human-readable catalog name.",
      "type": "string",
      "minLength": 1
    },
    "description": {
      "description": "Optional long description of the catalog.",
      "type": "string"
    },
    "homepage": {
      "description": "Optional catalog homepage URL.",
      "type": "string",
      "format": "uri"
    },
    "plugins": {
      "description": "The plugins this catalog offers. At least one.",
      "type": "array",
      "minItems": 1,
      "items": { "$ref": "#/$defs/plugin" }
    }
  },
  "$defs": {
    "plugin": {
      "type": "object",
      "required": ["name", "title", "type", "repo", "ref", "artifactSha256", "version", "minServerVersion"],
      "additionalProperties": false,
      "properties": {
        "name": {
          "description": "Plugin manifest name. MUST match the server's HttpInstaller::guardPluginName() regex byte-for-byte.",
          "type": "string",
          "pattern": "^phlix-plugin-[a-z0-9][a-z0-9-]*$"
        },
        "title": {
          "description": "Display name shown in the admin Plugins UI.",
          "type": "string",
          "minLength": 1
        },
        "type": {
          "description": "Plugin category. Enum so typos fail validation. Values that also exist in the server-side manifest enum (Phlix\\Shared\\Plugin\\ManifestType, mirrored in phlix-shared/schemas/manifest.schema.json) MUST be spelled identically — an entry's type should match the `type` in the plugin's own plugin.json at the pinned ref. NOTE: this enum and the manifest enum are not identical sets today: 'player' and 'integration' are catalog-only, and the manifest enum additionally offers auth-provider, library-type, tuner, transcoder-hook, arr-integration and analytics-sink, which no catalog entry has needed yet. 'ui-theme' was added for theme plugins (a plugin whose entry class implements Phlix\\Theming\\ThemeSourceInterface). The server does NOT dispatch on this field — PluginLoader::enable() registers a theme source off the `instanceof` alone and CatalogEntry carries `type` as a free-form display string — so this value is for validation and for the admin UI's category label, not for capability selection.",
          "type": "string",
          "enum": [
            "metadata-provider",
            "scrobbler",
            "subtitle-provider",
            "notifier",
            "player",
            "integration",
            "ui-theme"
          ]
        },
        "summary": {
          "description": "Optional one-line description.",
          "type": "string"
        },
        "description": {
          "description": "Optional long description.",
          "type": "string"
        },
        "repo": {
          "description": "Human repository URL. For the official catalog this is constrained to github.com under the detain/ org. A forked catalog can relax this pattern.",
          "type": "string",
          "format": "uri",
          "pattern": "^https://github\\.com/detain/phlix-plugin-[a-z0-9][a-z0-9-]*/?$"
        },
        "ref": {
          "description": "The 40-char lowercase commit sha this entry is pinned to (an exact commit in the plugin repo, never a branch or tag). The server downloads /archive/<ref>.tar.gz, not HEAD.",
          "type": "string",
          "pattern": "^[0-9a-f]{40}$"
        },
        "artifactSha256": {
          "description": "Bare 64-hex sha256 of the codeload tarball at the pinned ref (github.com/<owner>/<repo>/archive/<ref>.tar.gz). No 'sha256:' prefix. MUST move in lockstep with ref.",
          "type": "string",
          "pattern": "^[0-9a-f]{64}$"
        },
        "version": {
          "description": "The plugin's version at the pinned ref. For a release entry this is the semver read from the plugin.json at the tag commit (never the tag name's v-prefix form). The literal string \"dev\" denotes the dev-channel entry: the plugin repo's default-branch HEAD at last update — ref + artifactSha256 are that HEAD commit and its codeload tarball digest, NOT a semver release. A plugin appears at most twice: one release entry (semver) plus one dev entry (\"dev\").",
          "type": "string",
          "pattern": "^(?:dev|(0|[1-9]\\d*)\\.(0|[1-9]\\d*)\\.(0|[1-9]\\d*)(?:-(?:(?:0|[1-9]\\d*|\\d*[a-zA-Z-][0-9a-zA-Z-]*)(?:\\.(?:0|[1-9]\\d*|\\d*[a-zA-Z-][0-9a-zA-Z-]*))*))?(?:\\+[0-9a-zA-Z-]+(?:\\.[0-9a-zA-Z-]+)*)?)$"
        },
        "minServerVersion": {
          "description": "Minimum Phlix server version the plugin declares (from its plugin.json phlix_min_server_version at the pinned ref). REQUIRED (seceng M-PHLIX-PLUGINS-13): a plugin that cannot declare a minimum server version predates the install contract and must not occupy the official catalog. The escape hatch for a relaxed forked catalog is editing that fork's own copy of this schema — not shipping entries without the field. Enforcement status unchanged: catalog metadata only — the current server does NOT include this field in its catalog wire shape and does not gate the admin UI before download; it enforces compatibility at install time from the plugin's own manifest (PluginLoader::satisfiesServerVersion).",
          "type": "string",
          "pattern": "^(0|[1-9]\\d*)\\.(0|[1-9]\\d*)\\.(0|[1-9]\\d*)(?:-(?:(?:0|[1-9]\\d*|\\d*[a-zA-Z-][0-9a-zA-Z-]*)(?:\\.(?:0|[1-9]\\d*|\\d*[a-zA-Z-][0-9a-zA-Z-]*))*))?(?:\\+[0-9a-zA-Z-]+(?:\\.[0-9a-zA-Z-]+)*)?$"
        },
        "maxServerVersion": {
          "description": "Maximum Phlix server version supported by this plugin (exclusive upper bound). Optional. Catalog metadata only — same wire/enforcement situation as minServerVersion.",
          "type": "string",
          "pattern": "^(0|[1-9]\\d*)\\.(0|[1-9]\\d*)\\.(0|[1-9]\\d*)(?:-(?:(?:0|[1-9]\\d*|\\d*[a-zA-Z-][0-9a-zA-Z-]*)(?:\\.(?:0|[1-9]\\d*|\\d*[a-zA-Z-][0-9a-zA-Z-]*))*))?(?:\\+[0-9a-zA-Z-]+(?:\\.[0-9a-zA-Z-]+)*)?$"
        },
        "verified": {
          "description": "Whether this entry has been reviewed and verified by the catalog maintainer. An un-verified entry (false) is install-blocked by the server in default-deny mode. Dev-channel entries are always false and auto-discovered entries start false. The updater RESETS a carried true to false as a re-attestation event when the pin moves outside fast-forward lineage, or when a tag is recreated (same version, different commit).",
          "type": "boolean"
        },
        "deprecated": {
          "description": "Whether this plugin entry is deprecated. Deprecated entries may still be installable but the server will warn operators.",
          "type": "boolean"
        },
        "yanked": {
          "description": "Whether this plugin version has been yanked (withdrawn). A yanked entry is hidden from the catalog listing but still known to the server for operators who have it installed.",
          "type": "boolean"
        },
        "deprecationMessage": {
          "description": "Human-readable message shown when a deprecated or yanked entry is encountered. Explains why and what to use instead.",
          "type": "string"
        },
        "author": {
          "description": "Optional catalog-declared author/owner.",
          "type": "string"
        },
        "tags": {
          "description": "Optional free-form tags, bounded to mirror the updater's tag-sync and the catalog gate (seceng M-PHLIX-PLUGINS-12): every tag is lowercase-alphanumeric start/end with interior [._-] (GitHub's topic charset plus '.'), at most 48 interior chars, and at most 20 tags per entry — so tag farming by a repo adding bulk topics cannot mint an unbounded published tag list.",
          "type": "array",
          "maxItems": 20,
          "items": {
            "type": "string",
            "pattern": "^[a-z0-9](?:[a-z0-9._-]{0,48}[a-z0-9])?$"
          }
        }
      }
    }
  }
}
