{
  "schemaVersion": 2,
  "name": "Phlix Official Plugins",
  "description": "The default plugin catalog for Phlix. Add this as a plugin source in the admin Plugins section, then install plugins straight from the list.",
  "homepage": "https://github.com/detain/phlix-plugins",
  "plugins": [
    {
      "name": "phlix-plugin-anidb",
      "title": "AniDB",
      "type": "metadata-provider",
      "repo": "https://github.com/detain/phlix-plugin-anidb",
      "ref": "3bf51b6822b15ec990832169be0443189e28a729",
      "artifactSha256": "6de62ceef330f18faebc1e1b400dd4566ba4b25578164950b36d439ddb692b85",
      "version": "0.3.0",
      "minServerVersion": "1.2.0",
      "verified": true,
      "deprecated": false,
      "yanked": false,
      "author": "detain",
      "tags": [
        "anidb",
        "anime",
        "metadata",
        "metadata-provider"
      ],
      "summary": "Anime metadata from AniDB.",
      "description": "AniDB metadata provider — anime titles, descriptions, episodes and ratings via the AniDB UDP API and daily title dump."
    },
    {
      "name": "phlix-plugin-anidb",
      "title": "AniDB",
      "type": "metadata-provider",
      "repo": "https://github.com/detain/phlix-plugin-anidb",
      "ref": "9be97ed8533f23843a7a72b3f59e7c0817a1d6d2",
      "artifactSha256": "ede2afe254f5867ba5920eeb199b0dfc7efb43059520ca1323f9f618f7e7b722",
      "version": "dev",
      "minServerVersion": "1.2.0",
      "verified": false,
      "deprecated": false,
      "yanked": false,
      "author": "detain",
      "tags": [
        "anidb",
        "anime",
        "metadata",
        "metadata-provider"
      ]
    },
    {
      "name": "phlix-plugin-anilist",
      "title": "AniList",
      "type": "metadata-provider",
      "repo": "https://github.com/detain/phlix-plugin-anilist",
      "ref": "64e61a9a7feb5fbc2a17af68f31874f21a5bc923",
      "artifactSha256": "21f4da585ebe72df890412dba28b77027f015dea56c086db6428bba4e1227f8d",
      "version": "0.2.0",
      "minServerVersion": "1.2.0",
      "verified": true,
      "deprecated": false,
      "yanked": false,
      "author": "detain",
      "tags": [
        "anilist",
        "anime",
        "graphql",
        "library",
        "manga",
        "metadata",
        "metadata-provider",
        "otaku",
        "tracking",
        "watchlist"
      ],
      "summary": "Anime metadata and watchlist sync from AniList.",
      "description": "AniList metadata provider — anime/manga metadata, watchlist sync, and GraphQL integration via the AniList API."
    },
    {
      "name": "phlix-plugin-anilist",
      "title": "AniList",
      "type": "metadata-provider",
      "repo": "https://github.com/detain/phlix-plugin-anilist",
      "ref": "983a6e70a5ac084d8e44612d16be122b2780a9a8",
      "artifactSha256": "e7f07260422169828844d6eef85477a5a02c5696d5a86d2019e60220d5b1b6f4",
      "version": "dev",
      "minServerVersion": "1.2.0",
      "verified": false,
      "deprecated": false,
      "yanked": false,
      "author": "detain",
      "tags": [
        "anilist",
        "anime",
        "graphql",
        "library",
        "manga",
        "metadata",
        "metadata-provider",
        "otaku",
        "tracking",
        "watchlist"
      ]
    },
    {
      "name": "phlix-plugin-arctic-jade-theme",
      "title": "Arctic Jade Theme",
      "type": "ui-theme",
      "repo": "https://github.com/detain/phlix-plugin-arctic-jade-theme",
      "ref": "979fcc3b8c43604d076d72d3b4f7823193a46bc7",
      "artifactSha256": "2740cbaa11e56fc288c0ed795f2b657164e5d3f4efaf1221677517eaa1cfbceb",
      "version": "1.0.0",
      "minServerVersion": "0.44.0",
      "verified": false,
      "deprecated": false,
      "yanked": false,
      "author": "detain",
      "tags": [
        "arctic-jade",
        "crystal",
        "jade",
        "mit-license",
        "oceanic",
        "teal"
      ]
    },
    {
      "name": "phlix-plugin-arctic-jade-theme",
      "title": "Arctic Jade Theme",
      "type": "ui-theme",
      "repo": "https://github.com/detain/phlix-plugin-arctic-jade-theme",
      "ref": "5109d7a61a6f642db0bf616364f84e099608dd25",
      "artifactSha256": "03ef10130278e57230458aa0d8bf92816537f911fe5c177cff4423ad355bbe2c",
      "version": "dev",
      "minServerVersion": "0.44.0",
      "verified": false,
      "deprecated": false,
      "yanked": false,
      "author": "detain",
      "tags": [
        "arctic-jade",
        "crystal",
        "jade",
        "mit-license",
        "oceanic",
        "teal"
      ]
    },
    {
      "name": "phlix-plugin-emerald-abyss-theme",
      "title": "Emerald Abyss Theme",
      "type": "ui-theme",
      "repo": "https://github.com/detain/phlix-plugin-emerald-abyss-theme",
      "ref": "d90e90cb2a81e7cb7f9845efb66fd86fe8070c76",
      "artifactSha256": "064d55e9030961e8fc78de6311b5b0ad82752acb95a8de60248b470d2c22534c",
      "version": "1.0.0",
      "minServerVersion": "0.44.0",
      "verified": false,
      "deprecated": false,
      "yanked": false,
      "author": "detain",
      "tags": [
        "bioluminescent",
        "color-scheme",
        "deep-ocean",
        "design-system",
        "emerald",
        "emerald-abyss",
        "midnight",
        "oceanic",
        "teal"
      ]
    },
    {
      "name": "phlix-plugin-emerald-abyss-theme",
      "title": "Emerald Abyss Theme",
      "type": "ui-theme",
      "repo": "https://github.com/detain/phlix-plugin-emerald-abyss-theme",
      "ref": "448262918a8988a291b05cf12ee0d5db26a741fa",
      "artifactSha256": "67a4f6a552f2e92543ac06c6d8247096bb27ad2baa8af96b8cb7dfb5c8e38af9",
      "version": "dev",
      "minServerVersion": "0.44.0",
      "verified": false,
      "deprecated": false,
      "yanked": false,
      "author": "detain",
      "tags": [
        "bioluminescent",
        "color-scheme",
        "deep-ocean",
        "design-system",
        "emerald",
        "emerald-abyss",
        "midnight",
        "oceanic",
        "teal"
      ]
    },
    {
      "name": "phlix-plugin-example",
      "title": "Example",
      "type": "metadata-provider",
      "repo": "https://github.com/detain/phlix-plugin-example",
      "ref": "b3ecf24817ee67614e78282edbd51fa067327012",
      "artifactSha256": "97c201c4697bc5034d71268df9650a9e69fd6b32ca6e48db16e58dbdac88dc85",
      "version": "0.1.1",
      "minServerVersion": "0.10.0",
      "verified": false,
      "deprecated": false,
      "yanked": false,
      "author": "detain",
      "tags": [
        "metadata-provider"
      ]
    },
    {
      "name": "phlix-plugin-example",
      "title": "Example",
      "type": "metadata-provider",
      "repo": "https://github.com/detain/phlix-plugin-example",
      "ref": "99906be19790782413f9712e7b7fbdfa3df23692",
      "artifactSha256": "179a1e0ca47c03632ff8cc4fd13d67098df1c51d8b067b1305d1403f4eb1a96c",
      "version": "dev",
      "minServerVersion": "0.10.0",
      "verified": false,
      "deprecated": false,
      "yanked": false,
      "author": "detain",
      "tags": [
        "metadata-provider"
      ]
    },
    {
      "name": "phlix-plugin-jade-theme",
      "title": "Jade Theme",
      "type": "ui-theme",
      "repo": "https://github.com/detain/phlix-plugin-jade-theme",
      "ref": "0f3cb7539c15d7d4aa75cb549260114491240acc",
      "artifactSha256": "c9758227c786b590f5bded81160ca9e3700fb8505bbb7c7e6729e206d404bc55",
      "version": "1.0.0",
      "minServerVersion": "0.44.0",
      "verified": false,
      "deprecated": false,
      "yanked": false,
      "author": "detain",
      "tags": [
        "css-variables",
        "custom-theme",
        "emerald",
        "green-theme",
        "jade",
        "midnight-extended",
        "plugin",
        "theming",
        "token-overrides",
        "ui"
      ]
    },
    {
      "name": "phlix-plugin-jade-theme",
      "title": "Jade Theme",
      "type": "ui-theme",
      "repo": "https://github.com/detain/phlix-plugin-jade-theme",
      "ref": "ce101e9c55e659e53eae4477601193dbdcb75117",
      "artifactSha256": "e799f1995eec834b111cdb6d455c631ff92879b576fa0ad5f5ed458584a8b7f9",
      "version": "dev",
      "minServerVersion": "0.44.0",
      "verified": false,
      "deprecated": false,
      "yanked": false,
      "author": "detain",
      "tags": [
        "css-variables",
        "custom-theme",
        "emerald",
        "green-theme",
        "jade",
        "midnight-extended",
        "plugin",
        "theming",
        "token-overrides",
        "ui"
      ]
    },
    {
      "name": "phlix-plugin-lastfm",
      "title": "Last.fm",
      "type": "scrobbler",
      "repo": "https://github.com/detain/phlix-plugin-lastfm",
      "ref": "711c49769b4e09f578b974418d9aa13afaad4b75",
      "artifactSha256": "709eb7e4fa86ee5f3adb69b731414aad478f02bb908624a9a5ee98d2941a84a1",
      "version": "1.1.0",
      "minServerVersion": "1.2.0",
      "verified": true,
      "deprecated": false,
      "yanked": false,
      "author": "detain",
      "tags": [
        "last-fm",
        "lastfm",
        "music",
        "now-playing",
        "playback",
        "plugin",
        "scrobbler",
        "scrobbling"
      ],
      "summary": "Scrobble music playback to Last.fm.",
      "description": "Last.fm scrobbler — scrobbles music playback to Last.fm, marking now-playing on start and submitting the scrobble at the end."
    },
    {
      "name": "phlix-plugin-lastfm",
      "title": "Last.fm",
      "type": "scrobbler",
      "repo": "https://github.com/detain/phlix-plugin-lastfm",
      "ref": "4826087864890ed5ba974b4041858c8a63f58de6",
      "artifactSha256": "a324d8b20b428fd6434ac3b7dca8976223f513081258ff6da6cd662b9c4b6add",
      "version": "dev",
      "minServerVersion": "1.2.0",
      "verified": false,
      "deprecated": false,
      "yanked": false,
      "author": "detain",
      "tags": [
        "last-fm",
        "lastfm",
        "music",
        "now-playing",
        "playback",